acc_name,synonyms,occurrences,jk_notes
Crataegus monogyna,"Crataegus monogyna, Crataegus oxyacantha, Crataegus curvisepala, Crataegus oxyacantha var. paulii",643915,
Cirsium arvense,"Cirsium arvense, Carduus arvensis, Cirsium incanum, Cirsium setosum, Serratula arvensis, Cirsium arvense var. argenteum, Cirsium arvense var. horridum, Cirsium arvense var. integrifolium, Cirsium arvense var. mite, Cirsium arvense var. vestitum, Breea arvensis, Breea incana",618823,
Rumex acetosa,"Rumex acetosa, Acetosa alpestris, Rumex alpestris, Rumex acetosa ssp. acetosa, Rumex acetosa ssp. alpestris, Rumex acetosa ssp. ambiguus, Rumex acetosa ssp. arifolius, Acetosa pratensis ssp. alpestris",606224,
Filipendula ulmaria,"Filipendula ulmaria, Filipendula denudata, Spiraea ulmaria, Filipendula ulmaria ssp. denudata, Filipendula ulmaria ssp. ulmaria, Filipendula ulmaria var. denudata, Thecanisia ulmaria, Spiraea denudata, Thecanisia discolor",552321,
Anthoxanthum odoratum,"Anthoxanthum odoratum, Anthoxanthum pilosum, Anthoxanthum villosum, Xanthonanthos odoratum, Anthoxanthum odoratum var. altissimum",547771,
Poa trivialis,"Poa trivialis, Poa ariguensis, Poa callida, Poa maullinica, Poa modesta, Poa pichinchensis, Poa stolonifera, Poa trachyphylla, Poa woronowii, Poa trivialis var. filiculmis, Poa trivialis var. woronowii",532864,
Agrostis capillaris,"Agrostis capillaris, Agrostis tenuis, Agrostis tenuis var. aristata, Agrostis tenuis var. hispida, Agrostis tenuis var. pumila, Agrostis vulgaris, Agrostis sylvatica, Agrestis polymorpha, Agrostis diffusa, Agrostis hispida, Agrostis laxa, Agrostis lithuanica, Agrostis polymorpha, Agrostis pumila, Agrostis stricta, Agrostis tenella, Agrostis varians, Decandolia vulgaris, Trichodium capillaris, Trichodium strictum, Vilfa vulgaris, Agrostis alba ssp. vulgaris, Agrostis alba var. aristata, Agrostis alba var. minor, Agrostis alba var. silvatica, Agrostis alba var. stricta, Agrostis alba var. tenuis, Agrostis alba var. vulgaris, Agrostis capillaris var. aristata, Agrostis capillaris var. aristulata, Agrostis capillaris var. pumila, Agrostis palustris var. stricta, Agrostis polymorpha var. capillaris, Agrostis polymorpha var. pumila, Agrostis rubra var. pumila, Agrostis rubra var. tenella, Agrostis stolonifera var. hispida, Agrostis stolonifera var. minor, Agrostis stolonifera var. tenella, Agrostis stolonifera var. vulgaris, Agrostis tenuis var. tenuis, Agrostis vulgaris var. aristata, Agrostis vulgaris var. hispida, Agrostis vulgaris var. pumila, Agrostis vulgaris var. tenella, Vilfa divaricata var. pumila, Agrostis alba subvar. pumila, Agrostis tenuis f. aristata",524201,
Arrhenatherum elatius,"Arrhenatherum elatius, Arrhenatherum elatius var. biaristatum, Avena elatior, Arrhenatherum americanum, Arrhenatherum avenaceum, Arrhenatherum bulbosum, Arrhenatherum tuberosum, Avena avenaceum, Avena bulbosa, Avena elata, Avena tuberosa, Avenastrum elatius, Holcus avenaceus, Holcus bulbosus, Hordeum avenaceum",515186,
Sambucus nigra,,487287,Similar problem to Calystegia sepium. S. nigra ssp. canadensis is native https://florida.plantatlas.usf.edu/Plant.aspx?id=2186
Alnus glutinosa,"Alnus glutinosa, Betula alnus var. glutinosa, Betula glutinosa, Alnus alnus",471663,
Deschampsia cespitosa,"Deschampsia cespitosa, Deschampsia caespitosa, Aira cespitosa, Deschampsia cespitosa ssp. genuina, Aira caespitosa, Deschampsia caespitosa ssp. genuina, Agrostis caespitosa, Aira alpicola, Aira ambigua, Aira aristulata, Avena caespitosa, Campella caespitosa, Deschampsia alpicola, Deschampsia ambigua, Deschampsia andina, Deschampsia biebersteiniana, Deschampsia confinis, Deschampsia pungens, Podionapus caespitosus, Deschampsia cespitosa var. confinis, Deschampsia cespitosa var. strictior",456524,
Geranium robertianum,,434557,
Carex nigra,"Carex acuta, Carex nigra, Carex X aquanigra, Carex goodenowii, Carex nigra var. strictiformis, Carex vulgaris",431837,
Acer pseudoplatanus,,427813,
Geum urbanum,,401243,
Hypericum perforatum,,397491,
Phalaris arundinacea,"Phalaris arundinacea, Phalaroides arundinacea, Arundo colorata, Arundo riparia, Baldingera arundinacea, Baldingera colorata, Calamagrostis colorata, Calamagrostis variegata, Digraphis americana, Digraphis arundinacea, Endallex arundinacea, Endallex arundinaceae, Phalaridantha arundinacea, Typhoides arundinacea, Phalaris arundinacea ssp. typica, Phalaris arundinacea var. colorata, Phalaris arundinacea var. genuina, Phalaris arundinacea f. coarctata, Phalaris arundinacea f. minor, Phalaris arundinacea f. pallens, Phalaris arundinacea f. pallida, Phalaris arundinacea f. ramifera, Phalaris arundinacea f. ramosa",391216,
Silene vulgaris,"Silene vulgaris, Silene latifolia, Oberna commutata, Silene cucubalus, Silene inflata",386278,
Elymus repens,"Elymus repens, Agropyron repens, Elytrigia repens, Agropyron vaillantianum, Elytrigia vaillantiana, Triticum repens, Triticum vaillantianum, Elytrigia repens var. repens, Elytrigia repens var. vaillantiana, Agropyron repens var. subulatum, Elymus hoffmannii, Agropyron sachalinense, Agropyron subulatum, Braconotia officinarum, Elymus neogaeus, Elymus vaillantianus, Elytrigia vaillantianum, Triticum infestum, Triticum subulatum, Zeia repens, Elytrigia repens ssp. caesia, Trisetum repens ssp. magellanicum, Agropyron junceum var. repens, Agropyron repens var. aristatum, Agropyron repens var. nemorale, Agropyron repens var. pilosum, Agropyron repens var. pubescens, Agropyron repens var. repens, Agropyron repens var. vaillantianum, Agropyron repens var. vulgare, Elymus repens var. aristatus, Elytrigia repens var. aristata, Elytrigia repens var. caesium, Elytrigia repens var. glauca, Elytrigia repens var. pubescens, Elytrigia repens var. subulatum, Elytrigia repens var. vaillantianum, Triticum repens var. aristatum, Triticum repens var. caesium, Triticum repens var. subulatum, Triticum repens var. vulgare, Agropyron repens subvar. pubescens, Agropyron repens f. aristatum, Agropyron repens f. geniculatum, Agropyron repens f. heberhachis, Agropyron repens f. pilosum, Agropyron repens f. repens, Agropyron repens f. setiferum, Agropyron repens f. stoloniferum, Agropyron repens f. trichorrhachis, Agropyron repens f. vaillantianum, Triticum repens f. pubescens",381186,
Calystegia sepium,,376620,"This cosmopolitan species has a native subspecies. https://florida.plantatlas.usf.edu/Plant.aspx?id=2195 The taxonomy is not resolved, and infraspecific compatability is unknown"
Veronica chamaedrys,,360373,
Pinus halepensis,,350629,
Fragaria vesca,,347344,
Rosmarinus officinalis,"Rosmarinus officinalis, Rosmarinus officinalis var. prostratus",336234,
Bromus hordeaceus,"Bromus hordeaceus, Bromus mollis, Bromus mollis var. leiostachys, Avena mollis, Bromus leptostachys, Bromus megapotamicus, Bromus nanus, Forasaccus mollis, Serrafalcus hordeaceus, Serrafalcus mollis, Bromus hordeaceus ssp. mollis, Bromus mollis ssp. hordeaceus, Bromus hordeaceus var. leptostachys, Bromus hordeaceus var. mollis, Bromus leptostachys var. pubescens, Bromus mollis var. hordeaceus, Bromus mollis var. leptostachys, Bromus mollis var. nanus, Bromus secalinus var. hordeaceus, Bromus hordeaceus f. leiostachys, Bromus hordeaceus f. leptostachys, Bromus mollis f. nanus",304077,
Rhamnus frangula,"Frangula alnus, Rhamnus frangula var. angustifolia",298016,
Mentha aquatica,"Mentha aquatica, Mentha citrata, Mentha piperita ssp. citrata, Mentha X piperita var. citrata, Mentha X piperi var. citrata",285990,
Alopecurus pratensis,"Alopecurus pratensis, Alopecurus altissimus, Alopecurus aquaticus, Alopecurus brachyglossus, Alopecurus ciliatus, Alopecurus elongatus, Alopecurus laxiflorus, Alopecurus obscurus, Alopecurus pallidus, Alopecurus scaber, Alopecurus seravschanicus, Alopecurus sericeus, Alopecurus songaricus, Alopecurus trivialis, Phalaris aristata, Tozzettia pratensis, Alopecurus alpinus var. songaricus, Alopecurus alpinus f. songaricus, Alopecurus pratensis f. breviaristatus",281793,
Brachypodium sylvaticum,"Brachypodium sylvaticum, Festuca sylvatica, Agropyron sylvaticum, Brachypodium miserum, Brachypodium pubescens, Brachypodium wattii, Brevipodium sylvaticum, Bromus dumosus, Bromus sylvaticus, Triticum sylvaticum, Brachypodium sylvaticum ssp. dumosum, Brachypodium sylvaticum ssp. pubescens, Brachypodium gracile var. pubescens, Brevipodium sylvaticum var. dumosum, Brachypodium gracile f. pubescens",281279,
Glyceria fluitans,"Glyceria fluitans, Festuca fluitans, Panicularia fluitans, Devauxia fluitans, Hydrochloa fluitans, Melica fluitans, Panicularia brachyphylla, Poa fluitans, Glyceria fluitans var. acutiflora",279154,
Luzula campestris,"Luzula campestris, Juncoides campestre, Luzula campestris var. campestris",277845,
Ligustrum vulgare,,277160,
Juncus articulatus,"Juncus articulatus, Juncus articulatus var. obtusatus",269062,
Salix cinerea,"Salix cinerea, Salix cinerea ssp. cinerea",260589,
Galeopsis tetrahit,,260379,
Vicia sepium,,256952,
Cytisus scoparius,"Cytisus scoparius, Cytiscus scoparius",255450,
Pinus pinaster,,252320,
Poa nemoralis,"Poa nemoralis, Agrostis alba, Agrostis alba var. alba, Agrestis alba, Decandolia alba, Paneion nemorale, Poa asperula, Poa kamtschatica, Vilfa alba, Agrostis stolonifera var. alba, Agrostis vulgaris var. alba, Poa pratensis var. fagetorum, Agrostis alba f. alba, Agrostis stolonifera f. alba",245998,
Pilosella officinarum,,239747,
Pimpinella saxifraga,,231697,
Bromus sterilis,"Bromus sterilis, Anisantha sterilis, Bromus grandiflorus, Bromus jubatus, Genea sterilis, Schedonorus sterilis, Zerna sterilis",227181,
Tanacetum vulgare,"Tanacetum vulgare, Chrysanthemum vulgare, Tanacetum vulgare var. crispum, Tanacetum boreale",226946,
Draba verna,"Erophila verna, Draba verna, Draba praecox, Erophila spathulata, Erophila verna ssp. praecox, Erophila verna ssp. spathulata, Draba verna var. aestivalis, Draba verna var. boerhaavii, Draba verna var. major",213809,
Mycelis muralis,"Mycelis muralis, Lactuca muralis",211623,
Lamium galeobdolon,"Lamium galeobdolon, Lamiastrum galeobdolon",210263,"Accepted name by TPL, but with lowest level of confidence"
Symphytum officinale,"Symphytum officinale, Symphytum officinale var. officinale, Symphytum officinale ssp. uliginosum, Symphytum uliginosum",209629,
Holcus mollis,"Holcus mollis, Aira holcus-mollis, Aira mollis, Avena mollis, Avena sylvatica, Ginannia mollis, Notholcus mollis",209013,
Clematis vitalba,,206046,
Myosotis arvensis,"Myosotis arvensis, Myosotis scorpioides var. arvensis",204864,
Matricaria chamomilla,"Chamomilla recutita, Matricaria chamomilla, Matricaria courrantiana, Matricaria recutita, Chamomilla chamomilla, Matricaria suaveolens, Matricaria chamomilla var. coronata",203564,
Glyceria maxima,"Glyceria maxima, Glyceria spectabilis, Molinia maxima, Catabrosa hydrophila, Exydra aquatica, Festuca aquatica, Glyceria altissima, Glyceria aquatica, Heleochloa aquatica, Hydropoa spectabilis, Panicularia aquatica, Poa aquatica",184632,
Achillea ptarmica,,179967,
Sonchus arvensis,,175885,
Acer platanoides,"Acer platanoides, Acer platanoides var. schwedleri",163732,
Stachys officinalis,"Stachys officinalis, Betonica officinalis",158588,
Impatiens glandulifera,"Impatiens glandulifera, Impatiens roylei",156662,
Danthonia decumbens,"Danthonia decumbens, Sieglingia decumbens, Festuca decumbens, Bromus decumbens, Melica decumbens, Poa decumbens, Triodia decumbens",150168,
Veronica serpyllifolia,"Veronica serpyllifolia, Veronica humifusa, Veronica serpyllifolia ssp. serpyllifolia, Veronica serpyllifolia ssp. humifusa, Veronica tenella, Veronicastrum serpyllifolium, Veronicastrum serpyllifolium ssp. humifusum, Veronica serpyllifolia var. borealis, Veronica serpyllifolia var. humifusa, Veronica serpyllifolia var. nummularioides",145066,
Ulex europaeus,,142526,
Torilis japonica,,139876,
Trifolium medium,"Trifolium medium, Trifolium medium var. sarosiense",134121,
Thymus pulegioides,"Thymus pulegioides, Thymus serpyllum ssp. chamaedrys, Thymus serpyllum var. albus",131971,
Eucalyptus globulus,,131326,
Pulicaria dysenterica,"Pulicaria dysenterica, Inula dysenterica",119647,
Primula elatior,,118741,
Lupinus polyphyllus,,111039,
Potamogeton natans,,107500,
Helminthotheca echioides,"Helminthotheca echioides, Picris echioides",105080,
Malva sylvestris,"Malva sylvestris, Malva mauritiana, Malva sylvestris ssp. mauritiana, Malva sylvestris var. mauritiana",100727,
Sanguisorba officinalis,"Sanguisorba officinalis, Poterium officinale, Sanguisorba microcephala, Sanguisorba officinalis ssp. microcephala, Sanguisorba officinalis var. polygama",100458,
Carlina vulgaris,,98981,
Rhamnus cathartica,,97803,
Rumex conglomeratus,,97352,
Miconia calvescens,,94563,
Plantago coronopus,"Plantago coronopus, Plantago coronopus ssp. commutata",92062,
Jacobaea vulgaris,Senecio jacobaea,85743,
Avena barbata,"Avena barbata, Avena almeriensis, Avena deusta, Avena hoppeana, Avena sallentiana, Avena sesquitertia, Avena strigosa ssp. barbata, Avena sativa var. barbata, Avena barbata subvar. hirsuta",85037,
Papaver dubium,,84228,
Carduus crispus,,83302,
Solidago canadensis,,82801,Similar problem to Calystegia sepium. S. canadansis var. scabra is native https://florida.plantatlas.usf.edu/Plant.aspx?id=3031 Possible synonymy/taxonomy/nomenclature problem here as well.
Malva moschata,"Malva moschata, Malva moschata var. rosea",81528,
Spergularia rubra,"Spergularia rubra, Tissa rubra, Spergularia rubra var. perennans",80309,
Senecio sylvaticus,"Senecio sylvaticus, Senecio sylvatica",80270,
Avena fatua,"Avena fatua, Avena fatua var. glabrata, Avena fatua var. vilis, Anelytrum avenaceum, Avena intermedia, Avena lanuginosa, Avena meridionalis, Avena patens, Avena pilosa, Avena septentrionalis, Avena vilis, Avena fatua ssp. meridionalis, Avena fatua var. intermedia, Avena sativa var. fatua, Avena sativa var. sericea",78408,
Poa compressa,"Poa compressa, Paneion compressum, Poa compressa var. sylvestris, Poa compressa f. depauperata",74803,
Scrophularia auriculata,,72582,
Myosoton aquaticum,"Myosoton aquaticum, Alsine aquatica, Cerastium aquaticum, Malachium aquaticum, Stellaria aquatica",72493,
Salix fragilis,,71717,
Elodea nuttallii,"Elodea nuttallii, Elodea nuttalli, Elodea columbiana, Anacharis occidentalis, Elodea occidentalis, Anacharis nuttallii, Elodea minor, Philotria angustifolia, Philotria minor, Philotria nuttallii, Philotria occidentalis, Udora verticillata var. minor",70290,Native to US. Imperiled status in 2 states. Invasive elsewhere.
Filipendula vulgaris,"Filipendula vulgaris, Filipendula hexapetala, Spiraea filipendula",67784,
Alopecurus myosuroides,"Alopecurus myosuroides, Alopecurus agrestis, Alopecurus purpurascens, Tozzettia agrestis",67675,
Potentilla verna,"Potentilla neumanniana, Potentilla tabernaemontani",64216,
Hydrocharis morsus-ranae,,61866,
Berberis vulgaris,,61176,
Myosotis ramosissima,,59385,
Impatiens parviflora,,57764,
Ehrharta stipoides,Microlaena stipoides,54829,
Carduus nutans,"Carduus nutans, Carduus thoermeri, Carduus macrocephalus, Carduus macrolepis, Carduus nutans ssp. leiophyllus, Carduus nutans ssp. macrocephalus, Carduus nutans ssp. macrolepis, Carduus nutans ssp. nutans, Carduus nutans var. leiophyllus, Carduus nutans var. macrocephalus, Carduus nutans var. vestitus",53497,
Rhododendron tomentosum,"Rhododendron tomentosum, Ledum palustre, Ledum decumbens, Ledum palustre ssp. decumbens, Rhododendron tomentosum ssp. subacrticum, Rhododendron tomentosum ssp. subarcticum, Ledum palustre var. decumbens",53221,
